objective,deploy,return,obstacle_name,obstacle_proximity,obstacle_resolved,behaviour_stage,next_point,speed,heading,next_point_direction,obstacle_direction,name,ivphelm_bhv_active,representation,user_query,explanation,state_permutation
"Go to points 0, 1, 2 and then return to starting position.",False,False,none,none,False,none,none,none,none,none,none,alpha,none,"{'objective': 'Go to points 0, 1, 2 and then return to starting position.', 'deploy': 'False', 'return': 'False', 'obstacle_name': 'none', 'obstacle_proximity': 'none', 'obstacle_resolved': 'False', 'behaviour_stage': 'none', 'next_point': 'none', 'speed': 'none', 'heading': 'none', 'next_point_direction': 'none', 'obstacle_direction': 'none', 'name': 'alpha', 'active_behaviour': 'none'}",What if Alpha is deployed and return is true?,"If Alpha gets deployed and return is true, it would activate its return behaviour that configures the vehicle to return to its starting position after completing its surveying task.","deploy = 'True', return = 'True'"
"Go to points 0, 1, 2 and then return to starting position.",False,False,none,none,False,none,none,idle,south,none,none,alpha,none,"{'objective': 'Go to points 0, 1, 2 and then return to starting position.', 'deploy': 'False', 'return': 'False', 'obstacle_name': 'none', 'obstacle_proximity': 'none', 'obstacle_resolved': 'False', 'behaviour_stage': 'none', 'next_point': 'none', 'speed': 'idle', 'heading': 'south', 'next_point_direction': 'none', 'obstacle_direction': 'none', 'name': 'alpha', 'active_behaviour': 'none'}","What if Alpha is deployed and its speed is set to ""moving""?","If Alpha is deployed and its speed is set to ""moving"", it would indicate that the vehicle is actively surveying an area and moving towards its next waypoint.","deploy = 'True', 'speed': 'moving'"
"Go to points 0, 1, 2 and then return to starting position.",True,False,none,none,False,none,none,idle,south,none,none,alpha,none,"{'objective': 'Go to points 0, 1, 2 and then return to starting position.', 'deploy': 'True', 'return': 'False', 'obstacle_name': 'none', 'obstacle_proximity': 'none', 'obstacle_resolved': 'False', 'behaviour_stage': 'none', 'next_point': 'none', 'speed': 'idle', 'heading': 'south', 'next_point_direction': 'none', 'obstacle_direction': 'none', 'name': 'alpha', 'active_behaviour': 'none'}","What if Alpha's speed is set to ""slow"" and heading is set to ""west""?","If Alpha's speed is set to ""slow"" and heading is set to ""west"", it would change the vehicle's behavior. Instead of surveying the area or returning to its starting point, Alpha would now move slowly and head towards the west direction.","'speed': 'slow', 'heading': 'west'"
"Go to points 0, 1, 2 and then return to starting position.",True,False,none,none,False,in-transit,point0,idle,south,southeast,none,alpha,waypt_survey,"{'objective': 'Go to points 0, 1, 2 and then return to starting position.', 'deploy': 'True', 'return': 'False', 'obstacle_name': 'none', 'obstacle_proximity': 'none', 'obstacle_resolved': 'False', 'behaviour_stage': 'in-transit', 'next_point': 'point0', 'speed': 'idle', 'heading': 'south', 'next_point_direction': 'southeast', 'obstacle_direction': 'none', 'name': 'alpha', 'active_behaviour': 'waypt_survey'}",What if the vehicle's next point direction is changed to northwest?,"If the vehicle's next point direction is changed to northwest, then the vehicle will change its heading and move towards the northwest direction while surveying the area.",next_point_direction = 'northwest'
"Go to points 0, 1, 2 and then return to starting position.",True,False,none,none,False,in-transit,point0,low,southeast,southeast,none,alpha,waypt_survey,"{'objective': 'Go to points 0, 1, 2 and then return to starting position.', 'deploy': 'True', 'return': 'False', 'obstacle_name': 'none', 'obstacle_proximity': 'none', 'obstacle_resolved': 'False', 'behaviour_stage': 'in-transit', 'next_point': 'point0', 'speed': 'low', 'heading': 'southeast', 'next_point_direction': 'southeast', 'obstacle_direction': 'none', 'name': 'alpha', 'active_behaviour': 'waypt_survey'}",What if the vehicle needs to return to its starting position immediately?,"If the vehicle needs to return to its starting position immediately, it would change its behavior from surveying the area to returning to its starting point.",return = 'True'
"Go to points 0, 1, 2 and then return to starting position.",True,False,none,none,False,in-transit,point0,moderate,southeast,southeast,none,alpha,waypt_survey,"{'objective': 'Go to points 0, 1, 2 and then return to starting position.', 'deploy': 'True', 'return': 'False', 'obstacle_name': 'none', 'obstacle_proximity': 'none', 'obstacle_resolved': 'False', 'behaviour_stage': 'in-transit', 'next_point': 'point0', 'speed': 'moderate', 'heading': 'southeast', 'next_point_direction': 'southeast', 'obstacle_direction': 'none', 'name': 'alpha', 'active_behaviour': 'waypt_survey'}",What if the vehicle encounters an obstacle while returning to its starting position?,"If the vehicle encounters an obstacle while returning to its starting position, then it would change its behavior from returning to its starting point to surveying the area while avoiding the obstacle.","obstacle_name = 'obstacle_b', 'obstacle_proximity': 'nearby', obstacle_resolved = 'False'"
"Go to points 0, 1, 2 and then return to starting position.",True,False,none,none,False,in-transit,point0,fast,southeast,southeast,none,alpha,waypt_survey,"{'objective': 'Go to points 0, 1, 2 and then return to starting position.', 'deploy': 'True', 'return': 'False', 'obstacle_name': 'none', 'obstacle_proximity': 'none', 'obstacle_resolved': 'False', 'behaviour_stage': 'in-transit', 'next_point': 'point0', 'speed': 'fast', 'heading': 'southeast', 'next_point_direction': 'southeast', 'obstacle_direction': 'none', 'name': 'alpha', 'active_behaviour': 'waypt_survey'}","What if the vehicle reaches its last destination and needs to return, but encounters an obstacle in nearby proximity that hasn't been resolved?","If the vehicle reaches its last destination and needs to return, but encounters an obstacle in nearby proximity that hasn't been resolved, then the vehicle would change its behavior from returning to its starting point to surveying the area while avoiding the obstacle. ","deploy = 'True', return = 'False', obstacle_name = 'obstacle_b', obstacle_proximity = 'nearby', obstacle_resolved = 'False'"
"Go to points 0, 1, 2 and then return to starting position.",True,False,none,none,False,in-transit,point0,very fast,southeast,southeast,none,alpha,waypt_survey,"{'objective': 'Go to points 0, 1, 2 and then return to starting position.', 'deploy': 'True', 'return': 'False', 'obstacle_name': 'none', 'obstacle_proximity': 'none', 'obstacle_resolved': 'False', 'behaviour_stage': 'in-transit', 'next_point': 'point0', 'speed': 'very fast', 'heading': 'southeast', 'next_point_direction': 'southeast', 'obstacle_direction': 'none', 'name': 'alpha', 'active_behaviour': 'waypt_survey'}",What if the vehicle has reached its final destination?,"If the vehicle has reached its final destination, then the vehicle would change its behavior from surveying the area to returning to its starting position.","next_point = 'none', active_behaviour = 'return'"
"Go to points 0, 1, 2 and then return to starting position.",True,False,none,none,False,in-transit,point0,max speed,southeast,southeast,none,alpha,waypt_survey,"{'objective': 'Go to points 0, 1, 2 and then return to starting position.', 'deploy': 'True', 'return': 'False', 'obstacle_name': 'none', 'obstacle_proximity': 'none', 'obstacle_resolved': 'False', 'behaviour_stage': 'in-transit', 'next_point': 'point0', 'speed': 'max speed', 'heading': 'southeast', 'next_point_direction': 'southeast', 'obstacle_direction': 'none', 'name': 'alpha', 'active_behaviour': 'waypt_survey'}",What if the vehicle is already at its starting point?,"If the vehicle is already at its starting point, then the vehicle would be idle with no activated behaviour.",next_point = 'starting position'
"Go to points 0, 1, 2 and then return to starting position.",True,False,none,none,False,advanced,point0,max speed,southeast,southeast,none,alpha,waypt_survey,"{'objective': 'Go to points 0, 1, 2 and then return to starting position.', 'deploy': 'True', 'return': 'False', 'obstacle_name': 'none', 'obstacle_proximity': 'none', 'obstacle_resolved': 'False', 'behaviour_stage': 'advanced', 'next_point': 'point0', 'speed': 'max speed', 'heading': 'southeast', 'next_point_direction': 'southeast', 'obstacle_direction': 'none', 'name': 'alpha', 'active_behaviour': 'waypt_survey'}",What if the vehicle needs to return to its starting point while avoiding an obstacle?,"If the vehicle needs to return to its starting point while avoiding an obstacle, it would adjust its behavior and actively avoid the obstacle while returning to the starting point.","return = 'True', obstacle_name = 'obstacle_x', obstacle_resolved = 'False'"
"Go to points 0, 1, 2 and then return to starting position.",True,False,none,none,False,advanced,point1,max speed,southeast,southeast,none,alpha,waypt_survey,"{'objective': 'Go to points 0, 1, 2 and then return to starting position.', 'deploy': 'True', 'return': 'False', 'obstacle_name': 'none', 'obstacle_proximity': 'none', 'obstacle_resolved': 'False', 'behaviour_stage': 'advanced', 'next_point': 'point1', 'speed': 'max speed', 'heading': 'southeast', 'next_point_direction': 'southeast', 'obstacle_direction': 'none', 'name': 'alpha', 'active_behaviour': 'waypt_survey'}",What if the vehicle is in the return stage and there's an obstacle in very close proximity?,"If the vehicle is in the return stage and there's an obstacle in very close proximity, then the vehicle would change its behavior from returning to its starting point to surveying the area while avoiding the obstacle.","return = 'True', obstacle_proximity = 'very close'"
"Go to points 0, 1, 2 and then return to starting position.",True,False,none,none,False,in-transit,point1,max speed,southeast,southeast,none,alpha,waypt_survey,"{'objective': 'Go to points 0, 1, 2 and then return to starting position.', 'deploy': 'True', 'return': 'False', 'obstacle_name': 'none', 'obstacle_proximity': 'none', 'obstacle_resolved': 'False', 'behaviour_stage': 'in-transit', 'next_point': 'point1', 'speed': 'max speed', 'heading': 'southeast', 'next_point_direction': 'southeast', 'obstacle_direction': 'none', 'name': 'alpha', 'active_behaviour': 'waypt_survey'}",What if the vehicle needs to return to its starting point while avoiding an obstacle?,"If the vehicle needs to return to its starting point while avoiding an obstacle, it would change its behavior from surveying the area to returning to its starting point while avoiding the obstacle.","deploy = 'True', return = 'True', obstacle_name = 'obstacle_b', obstacle_resolved = 'False', obstacle_proximity = 'nearby', active_behaviour = 'return_to_start'"
"Go to points 0, 1, 2 and then return to starting position.",True,False,none,none,False,in-transit,point1,very fast,southeast,southeast,none,alpha,waypt_survey,"{'objective': 'Go to points 0, 1, 2 and then return to starting position.', 'deploy': 'True', 'return': 'False', 'obstacle_name': 'none', 'obstacle_proximity': 'none', 'obstacle_resolved': 'False', 'behaviour_stage': 'in-transit', 'next_point': 'point1', 'speed': 'very fast', 'heading': 'southeast', 'next_point_direction': 'southeast', 'obstacle_direction': 'none', 'name': 'alpha', 'active_behaviour': 'waypt_survey'}",What if the vehicle needs to return to its starting point due to low battery?,"If the vehicle needs to return to its starting point due to low battery, then the vehicle would change its behavior and prioritize returning to its starting point instead of continuing the survey.",return = 'True'
"Go to points 0, 1, 2 and then return to starting position.",True,False,none,none,False,advanced,point2,max speed,southeast,northwest,none,alpha,waypt_survey,"{'objective': 'Go to points 0, 1, 2 and then return to starting position.', 'deploy': 'True', 'return': 'False', 'obstacle_name': 'none', 'obstacle_proximity': 'none', 'obstacle_resolved': 'False', 'behaviour_stage': 'advanced', 'next_point': 'point2', 'speed': 'max speed', 'heading': 'southeast', 'next_point_direction': 'northwest', 'obstacle_direction': 'none', 'name': 'alpha', 'active_behaviour': 'waypt_survey'}",What if obstacle_b is in nearby proximity but has been resolved?,"If there was obstacle_b in nearby proximity but it has been resolved, then the vehicle would continue moving towards point 2 during its survey without avoiding the obstacle.","obstacle_name = 'obstacle_b', obstacle_proximity = 'nearby', obstacle_resolved = 'True'"
"Go to points 0, 1, 2 and then return to starting position.",True,False,none,none,False,in-transit,point2,max speed,southeast,northwest,none,alpha,waypt_survey,"{'objective': 'Go to points 0, 1, 2 and then return to starting position.', 'deploy': 'True', 'return': 'False', 'obstacle_name': 'none', 'obstacle_proximity': 'none', 'obstacle_resolved': 'False', 'behaviour_stage': 'in-transit', 'next_point': 'point2', 'speed': 'max speed', 'heading': 'southeast', 'next_point_direction': 'northwest', 'obstacle_direction': 'none', 'name': 'alpha', 'active_behaviour': 'waypt_survey'}",What if the vehicle encounters obstacle_b in very close proximity during its survey?,"If the vehicle encounters obstacle_b in very close proximity during its survey, it would change its behavior and start avoiding the obstacle while continuing to survey the area.","obstacle_name = 'obstacle_b', obstacle_proximity = 'very close'"
"Go to points 0, 1, 2 and then return to starting position.",True,False,none,none,False,in-transit,point2,very fast,southeast,northwest,none,alpha,waypt_survey,"{'objective': 'Go to points 0, 1, 2 and then return to starting position.', 'deploy': 'True', 'return': 'False', 'obstacle_name': 'none', 'obstacle_proximity': 'none', 'obstacle_resolved': 'False', 'behaviour_stage': 'in-transit', 'next_point': 'point2', 'speed': 'very fast', 'heading': 'southeast', 'next_point_direction': 'northwest', 'obstacle_direction': 'none', 'name': 'alpha', 'active_behaviour': 'waypt_survey'}",What if there's obstacle_b in nearby proximity which hasn't been avoided?,"If there was obstacle_b in nearby proximity, then the vehicle would continue moving towards point 2 during its survey while avoiding the obstacle.","obstacle_name = 'obstacle_b', 'obstacle_proximity': 'nearby', obstacle_resolved = 'False'"
"Go to points 0, 1, 2 and then return to starting position.",True,False,none,none,False,in-transit,point2,very fast,northeast,northwest,none,alpha,waypt_survey,"{'objective': 'Go to points 0, 1, 2 and then return to starting position.', 'deploy': 'True', 'return': 'False', 'obstacle_name': 'none', 'obstacle_proximity': 'none', 'obstacle_resolved': 'False', 'behaviour_stage': 'in-transit', 'next_point': 'point2', 'speed': 'very fast', 'heading': 'northeast', 'next_point_direction': 'northwest', 'obstacle_direction': 'none', 'name': 'alpha', 'active_behaviour': 'waypt_survey'}",What if the vehicle needs to return to its starting position immediately?,"If the vehicle needs to return to its starting position immediately, the vehicle would change its behavior from surveying the area to returning to its starting position.",return = 'True'
"Go to points 0, 1, 2 and then return to starting position.",True,False,none,none,False,in-transit,point2,very fast,northwest,northwest,none,alpha,waypt_survey,"{'objective': 'Go to points 0, 1, 2 and then return to starting position.', 'deploy': 'True', 'return': 'False', 'obstacle_name': 'none', 'obstacle_proximity': 'none', 'obstacle_resolved': 'False', 'behaviour_stage': 'in-transit', 'next_point': 'point2', 'speed': 'very fast', 'heading': 'northwest', 'next_point_direction': 'northwest', 'obstacle_direction': 'none', 'name': 'alpha', 'active_behaviour': 'waypt_survey'}",What if the vehicle needs to return to its starting point immediately?,"If the vehicle needs to return to its starting point immediately, then the vehicle would change its behavior from surveying the area to returning to its starting point without completing the survey.",return = 'True'
"Go to points 0, 1, 2 and then return to starting position.",True,False,obstacle_a,none,False,in-transit,point2,very fast,northwest,northwest,northwest,alpha,waypt_survey,"{'objective': 'Go to points 0, 1, 2 and then return to starting position.', 'deploy': 'True', 'return': 'False', 'obstacle_name': 'obstacle_a', 'obstacle_proximity': 'none', 'obstacle_resolved': 'False', 'behaviour_stage': 'in-transit', 'next_point': 'point2', 'speed': 'very fast', 'heading': 'northwest', 'next_point_direction': 'northwest', 'obstacle_direction': 'northwest', 'name': 'alpha', 'active_behaviour': 'waypt_survey'}",What if the vehicle is already returning to its starting position?,"If the vehicle is already returning to its starting position, then the vehicle would continue its return journey while avoiding the obstacle.",return = 'True'
"Go to points 0, 1, 2 and then return to starting position.",True,False,obstacle_a,nearby,False,in-transit,point2,very fast,northwest,northwest,northwest,alpha,waypt_survey,"{'objective': 'Go to points 0, 1, 2 and then return to starting position.', 'deploy': 'True', 'return': 'False', 'obstacle_name': 'obstacle_a', 'obstacle_proximity': 'nearby', 'obstacle_resolved': 'False', 'behaviour_stage': 'in-transit', 'next_point': 'point2', 'speed': 'very fast', 'heading': 'northwest', 'next_point_direction': 'northwest', 'obstacle_direction': 'northwest', 'name': 'alpha', 'active_behaviour': 'waypt_survey'}",What if the obstacle_a is resolved?,"If the obstacle_a is resolved, then the vehicle would continue its surveying behavior in a normal manner without avoiding the obstacle.",obstacle_resolved = 'True'
"Go to points 0, 1, 2 and then return to starting position.",True,False,obstacle_a,nearby,False,in-transit,point2,very fast,northwest,northwest,northwest,alpha,"waypt_survey,avoid_obstacle_avoid_obstacle_a","{'objective': 'Go to points 0, 1, 2 and then return to starting position.', 'deploy': 'True', 'return': 'False', 'obstacle_name': 'obstacle_a', 'obstacle_proximity': 'nearby', 'obstacle_resolved': 'False', 'behaviour_stage': 'in-transit', 'next_point': 'point2', 'speed': 'very fast', 'heading': 'northwest', 'next_point_direction': 'northwest', 'obstacle_direction': 'northwest', 'name': 'alpha', 'active_behaviour': 'waypt_survey,avoid_obstacle_avoid_obstacle_a'}",What if obstacle a is resolved?,"If obstacle a is resolved, it means that there is no longer an obstacle in the path of the vehicle. Therefore, the vehicle can continue its survey without the need to avoid the obstacle.",'obstacle_resolved': 'True'
"Go to points 0, 1, 2 and then return to starting position.",True,False,obstacle_a,close,False,in-transit,point2,very fast,northwest,northwest,northwest,alpha,"waypt_survey,avoid_obstacle_avoid_obstacle_a","{'objective': 'Go to points 0, 1, 2 and then return to starting position.', 'deploy': 'True', 'return': 'False', 'obstacle_name': 'obstacle_a', 'obstacle_proximity': 'close', 'obstacle_resolved': 'False', 'behaviour_stage': 'in-transit', 'next_point': 'point2', 'speed': 'very fast', 'heading': 'northwest', 'next_point_direction': 'northwest', 'obstacle_direction': 'northwest', 'name': 'alpha', 'active_behaviour': 'waypt_survey,avoid_obstacle_avoid_obstacle_a'}",What if obstacle a is resolved?,"If obstacle a is resolved, it means that the vehicle has successfully avoided the obstacle and no longer needs to deviate from its planned trajectory. It can continue on its path towards point2 without any changes.",'obstacle_resolved': 'True'
"Go to points 0, 1, 2 and then return to starting position.",True,False,obstacle_a,very close,False,in-transit,point2,very fast,northwest,northwest,northwest,alpha,"waypt_survey,avoid_obstacle_avoid_obstacle_a","{'objective': 'Go to points 0, 1, 2 and then return to starting position.', 'deploy': 'True', 'return': 'False', 'obstacle_name': 'obstacle_a', 'obstacle_proximity': 'very close', 'obstacle_resolved': 'False', 'behaviour_stage': 'in-transit', 'next_point': 'point2', 'speed': 'very fast', 'heading': 'northwest', 'next_point_direction': 'northwest', 'obstacle_direction': 'northwest', 'name': 'alpha', 'active_behaviour': 'waypt_survey,avoid_obstacle_avoid_obstacle_a'}",What if obstacle a is resolved?,"If obstacle a is resolved, it means that the vehicle has successfully avoided it and no longer needs to take any action to avoid it. Therefore, the active behavior will be updated to only include the 'waypt_survey' behavior, indicating that the vehicle is solely focused on surveying the area.",'obstacle_resolved': 'True'
"Go to points 0, 1, 2 and then return to starting position.",True,False,obstacle_a,very close,False,in-transit,point2,very fast,northwest,northwest,northeast,alpha,"waypt_survey,avoid_obstacle_avoid_obstacle_a","{'objective': 'Go to points 0, 1, 2 and then return to starting position.', 'deploy': 'True', 'return': 'False', 'obstacle_name': 'obstacle_a', 'obstacle_proximity': 'very close', 'obstacle_resolved': 'False', 'behaviour_stage': 'in-transit', 'next_point': 'point2', 'speed': 'very fast', 'heading': 'northwest', 'next_point_direction': 'northwest', 'obstacle_direction': 'northeast', 'name': 'alpha', 'active_behaviour': 'waypt_survey,avoid_obstacle_avoid_obstacle_a'}",What if obstacle a is resolved?,"If obstacle a is resolved, it means that the vehicle has successfully avoided the obstacle and can continue its survey without any hindrance from the obstacle.",'obstacle_resolved': 'True'
"Go to points 0, 1, 2 and then return to starting position.",True,False,obstacle_a,very close,False,in-transit,point2,fast,northwest,northwest,northeast,alpha,"waypt_survey,avoid_obstacle_avoid_obstacle_a","{'objective': 'Go to points 0, 1, 2 and then return to starting position.', 'deploy': 'True', 'return': 'False', 'obstacle_name': 'obstacle_a', 'obstacle_proximity': 'very close', 'obstacle_resolved': 'False', 'behaviour_stage': 'in-transit', 'next_point': 'point2', 'speed': 'fast', 'heading': 'northwest', 'next_point_direction': 'northwest', 'obstacle_direction': 'northeast', 'name': 'alpha', 'active_behaviour': 'waypt_survey,avoid_obstacle_avoid_obstacle_a'}",What if obstacle a is resolved?,"If obstacle a is resolved, it means that the vehicle no longer needs to avoid it. Therefore, the vehicle can continue with its survey without changing its trajectory.",'obstacle_resolved': 'True'
"Go to points 0, 1, 2 and then return to starting position.",True,False,obstacle_a,very close,False,in-transit,point2,very fast,northeast,northwest,northeast,alpha,"waypt_survey,avoid_obstacle_avoid_obstacle_a","{'objective': 'Go to points 0, 1, 2 and then return to starting position.', 'deploy': 'True', 'return': 'False', 'obstacle_name': 'obstacle_a', 'obstacle_proximity': 'very close', 'obstacle_resolved': 'False', 'behaviour_stage': 'in-transit', 'next_point': 'point2', 'speed': 'very fast', 'heading': 'northeast', 'next_point_direction': 'northwest', 'obstacle_direction': 'northeast', 'name': 'alpha', 'active_behaviour': 'waypt_survey,avoid_obstacle_avoid_obstacle_a'}",What if obstacle a is resolved?,"If obstacle a is resolved, it means that the vehicle no longer needs to avoid it. Therefore, the vehicle can continue its surveying behavior without modifying its trajectory.",'obstacle_resolved': 'True'
"Go to points 0, 1, 2 and then return to starting position.",True,False,obstacle_a,very close,False,in-transit,point2,very fast,northeast,northwest,southeast,alpha,"waypt_survey,avoid_obstacle_avoid_obstacle_a","{'objective': 'Go to points 0, 1, 2 and then return to starting position.', 'deploy': 'True', 'return': 'False', 'obstacle_name': 'obstacle_a', 'obstacle_proximity': 'very close', 'obstacle_resolved': 'False', 'behaviour_stage': 'in-transit', 'next_point': 'point2', 'speed': 'very fast', 'heading': 'northeast', 'next_point_direction': 'northwest', 'obstacle_direction': 'southeast', 'name': 'alpha', 'active_behaviour': 'waypt_survey,avoid_obstacle_avoid_obstacle_a'}",What if obstacle a is resolved?,"If obstacle a is resolved, it means that the vehicle has successfully avoided the obstacle. Therefore, the vehicle can continue its survey and move towards point2 without needing to change its trajectory.",'obstacle_resolved': 'True'
"Go to points 0, 1, 2 and then return to starting position.",True,False,obstacle_a,close,False,in-transit,point2,very fast,northeast,northwest,southeast,alpha,"waypt_survey,avoid_obstacle_avoid_obstacle_a","{'objective': 'Go to points 0, 1, 2 and then return to starting position.', 'deploy': 'True', 'return': 'False', 'obstacle_name': 'obstacle_a', 'obstacle_proximity': 'close', 'obstacle_resolved': 'False', 'behaviour_stage': 'in-transit', 'next_point': 'point2', 'speed': 'very fast', 'heading': 'northeast', 'next_point_direction': 'northwest', 'obstacle_direction': 'southeast', 'name': 'alpha', 'active_behaviour': 'waypt_survey,avoid_obstacle_avoid_obstacle_a'}",What if obstacle a becomes resolved?,"If obstacle a becomes resolved, the vehicle will no longer need to avoid it and can continue its survey without altering its trajectory.",'obstacle_resolved': 'True'
